,uri,tituloOriginal,tituloExtraido,codigo
1427,https://w3id.org/scholarlydata/inproceedings/iswc2012/proceedings-2/paper-03,Link Discovery with Guaranteed Reduction Ratio in Affine Spaces with Minkowski Measures,Link Discovery with Guaranteed Reduction Ratio in Affine Spaces with Minkowski Measures,5cda6478aeb41273218dd78101b24bdb4b48df38
1428,https://w3id.org/scholarlydata/inproceedings/iswc2012/proceedings-2/paper-35,Performance Heterogeneity and Approximate Reasoning in Description Logic Ontologies,Performance Heterogeneity and Approximate Reasoning in Description Logic Ontologies,32cc4f51001f40ec118341f87e0a4b8681a87f6d
1429,https://w3id.org/scholarlydata/inproceedings/iswc2012/proceedings-2/paper-09,Collaborative Filtering by Analyzing Dynamic User Interests Modeled by Taxonomy,Collaborative Filtering by Analyzing Dynamic User Interests Modeled by Taxonomy,58869991b899b55391f19cddf3a9828c66c2273b
1430,https://w3id.org/scholarlydata/inproceedings/iswc2012/proceedings-2/paper-06,Concept-Based Semantic Difference in Expressive Description Logics,Concept-Based Semantic Difference in Expressive Description Logics,943b952976b8b9fb29920d81904a25d023ed16cd
1431,https://w3id.org/scholarlydata/inproceedings/iswc2012/proceedings-2/paper-41,CrowdMAP: Crowdsourcing Ontology Alignment with Microtasks,CrowdMap: Crowdsourcing Ontology Alignment with Microtasks,06be6eb9585d070c979f89ae19fe84fe4ab355a1
1432,https://w3id.org/scholarlydata/inproceedings/iswc2012/proceedings-2/paper-07,Semantic Enrichment by Non-Experts: Usability of Manual Annotation Tools,Semantic Enrichment by Non-experts: Usability of Manual Annotation Tools,53080fedde5915fb89f85d6112a3aa7c38b3deb2
1433,https://w3id.org/scholarlydata/inproceedings/iswc2012/proceedings-2/paper-39,Mining Semantic Relations between Research Areas,Mining Semantic Relations between Research Areas,474dca712c8836cb561f71702e496da025d2e4b7
1434,https://w3id.org/scholarlydata/inproceedings/iswc2012/proceedings-2/paper-04,The Not-So-Easy Task of Computing Class Subsumptions in OWL RL,The Not-So-Easy Task of Computing Class Subsumptions in OWL RL,5e2ffba5bc5c21719dab6001bfd34c4f0023ef08
1435,https://w3id.org/scholarlydata/inproceedings/iswc2012/proceedings-2/paper-30,Domain-aware Ontology Matching,Domain-Aware Ontology Matching,40721006dd62d751ba0b1b0017cc7a589f188fc1
1436,https://w3id.org/scholarlydata/inproceedings/iswc2012/proceedings-2/paper-25,Strabon: A Semantic Geospatial DBMS,Strabon: A Semantic Geospatial DBMS,d43cc07d72b06535bfbe5f1e5d7bcfbecd8e4e5b
1437,https://w3id.org/scholarlydata/inproceedings/iswc2012/proceedings-2/paper-22,A Machine Learning Approach for Instance Matching Based on Similarity Metrics,A Machine Learning Approach for Instance Matching Based on Similarity Metrics,1ca2306005f67af14422ce440809d49bb8861c30
1438,https://w3id.org/scholarlydata/inproceedings/iswc2012/proceedings-2/paper-37,An Evidence-based Verification Approach to Extract Entities and Relations for Knowledge Base Population,An Evidence-Based Verification Approach to Extract Entities and Relations for Knowledge Base Population,9c91b765df3a069933018c2393f40a08aa2bab53
1439,https://w3id.org/scholarlydata/inproceedings/iswc2012/proceedings-2/paper-28,Discovering Concept Coverings in Ontologies of Linked Data Sources,Discovering Concept Coverings in Ontologies of Linked Data Sources,3259ffe9b38877ba33d596dab5ffe64bde546a1d
1440,https://w3id.org/scholarlydata/inproceedings/iswc2012/proceedings-2/paper-08,Personalised Graph-based Selection of Web APIs,Personalised Graph-Based Selection of Web APIs,5dc9dddd201f6748274251060187f78ce129611e
1441,https://w3id.org/scholarlydata/inproceedings/iswc2012/proceedings-2/paper-29,A Formal Semantics for Weighted Ontology Mappings,A Formal Semantics for Weighted Ontology Mappings,824c07d687e30e89c795376b4be6bd31caf24615
1442,https://w3id.org/scholarlydata/inproceedings/iswc2012/proceedings-2/paper-01,On the Diversity and Availability of Temporal Information in Linked Open Data,On the Diversity and Availability of Temporal Information in Linked Open Data,b9c1e8673f9b5d8f9da6e88f1226b6b4e3b9a137
1443,https://w3id.org/scholarlydata/inproceedings/iswc2012/proceedings-2/paper-32,SPLODGE: Systematic Generation of SPARQL Benchmark Queries for Linked Open Data,SPLODGE: Systematic Generation of SPARQL Benchmark Queries for Linked Open Data,5bc240ca03519026a28f4cc4fb78ba412f102b67
1444,https://w3id.org/scholarlydata/inproceedings/iswc2012/proceedings-2/paper-31,Robust Runtime Optimization and Skew-Resistant Execution of Analytical SPARQL Queries on Pig,Robust Runtime Optimization and Skew-Resistant Execution of Analytical SPARQL Queries on Pig,5ba9d399e35235f4e5f1d66c2481534763446ef7
1445,https://w3id.org/scholarlydata/inproceedings/iswc2012/proceedings-2/paper-05,MORe: Modular Combination of OWL Reasoners for Ontology Classification,MORe: Modular Combination of OWL Reasoners for Ontology Classification,dbf3a37f9f39c11d17ee9c2701e90b17b9f3fc86
1446,https://w3id.org/scholarlydata/inproceedings/iswc2012/proceedings-2/paper-34,Hitting the Sweetspot: Economic Rewriting of Knowledge Bases,Hitting the Sweetspot: Economic Rewriting of Knowledge Bases,1c9d01a1b051d000dd254dc842c21c9f7e0a421d
1447,https://w3id.org/scholarlydata/inproceedings/iswc2012/proceedings-2/paper-40,Semantic Sentiment Analysis of Twitter,Semantic Sentiment Analysis of Twitter,01f3fdbc51a44f4c39c23580f766375851fa40b8
1448,https://w3id.org/scholarlydata/inproceedings/iswc2012/proceedings-2/paper-26,An Efficient Bit Vector Approach to Semantics-based Machine Perception in Resource-Constrained Devices,An Efficient Bit Vector Approach to Semantics-Based Machine Perception in Resource-Constrained Devices,c950365b5deb72819ad7a9b8aa6e8bdab9a2369a
1449,https://w3id.org/scholarlydata/inproceedings/iswc2012/proceedings-1/paper-39,Incorporating Semantic Knowledge into Dynamic Data Processing for Smart Power Grids,Incorporating Semantic Knowledge into Dynamic Data Processing for Smart Power Grids,edc3b38089e45a52363fd5c5c8571d526531511d
1450,https://w3id.org/scholarlydata/inproceedings/iswc2012/proceedings-1/paper-34,Managing the life-cycle of Linked Data with the LOD2 Stack,Managing the Life-Cycle of Linked Data with the LOD2 Stack,9e4e092288c23980345f2bce87cba0b34a57b596
1451,https://w3id.org/scholarlydata/inproceedings/iswc2012/proceedings-1/paper-40,Linking Smart Cities Datasets with Human Computation - the case of UrbanMatch,Linking Smart Cities Datasets with Human Computation - The Case of UrbanMatch,3cdb6877b80c9047b647546bcc049713705dfcb7
1452,https://w3id.org/scholarlydata/inproceedings/iswc2012/proceedings-1/paper-19,Evaluating Semantic Search Query Approaches with Expert and Casual Users,Evaluating Semantic Search Query Approaches with Expert and Casual Users,87ad5c862751bbee92dc0a8327bee2b042edbfc1
1453,https://w3id.org/scholarlydata/inproceedings/iswc2012/proceedings-1/paper-20,Benchmarking Federated SPARQL Query Engines: Are Existing Testbeds Enough?,Benchmarking Federated SPARQL Query Engines: Are Existing Testbeds Enough?,ca140e28c288dc8ac70ff3e584eab869c8492ff6
1454,https://w3id.org/scholarlydata/inproceedings/iswc2012/proceedings-1/paper-35,Using SPARQL to Query BioPortal Ontologies and Metadata,Using SPARQL to Query BioPortal Ontologies and Metadata,35e812e211cc24496f8378a8478d9b5984c3cb88
1455,https://w3id.org/scholarlydata/inproceedings/iswc2012/proceedings-1/paper-03,Burst the Filter Bubble: Using Semantic Web to Enable Serendipity,Burst the Filter Bubble: Using Semantic Web to Enable Serendipity,a06d6219d6724f7a5ae0e4d8b4b03f9d2efba620
1456,https://w3id.org/scholarlydata/inproceedings/iswc2012/proceedings-1/paper-16,Linked Stream Data Processing Engines: Facts and Figures,Linked Stream Data Processing Engines: Facts and Figures,2a9a830aaac6857387369446f49eb18a0e4f2c75
1457,https://w3id.org/scholarlydata/inproceedings/iswc2012/proceedings-1/paper-32,Achieving Interoperability through Semantics-based Technologies: The Instant Messaging Case,Achieving Interoperability through Semantics-Based Technologies: The Instant Messaging Case,0e1f25907d931afc8cea4124010d282dceb27c4b
1458,https://w3id.org/scholarlydata/inproceedings/iswc2012/proceedings-1/paper-29,Query Driven Hypothesis Generation for Answering Queries over NLP Graphs,Query Driven Hypothesis Generation for Answering Queries over NLP Graphs,b4f5685b57afaffd11b75c2b9a427c94c2eb22b3
1459,https://w3id.org/scholarlydata/inproceedings/iswc2012/proceedings-1/paper-18,Tag Recommendation for Large-Scale Ontology-Based Information Systems,Tag Recommendation for Large-Scale Ontology-Based Information Systems,4d97f4255951da2460b29422f76165861f4709df
1460,https://w3id.org/scholarlydata/inproceedings/iswc2012/proceedings-1/paper-21,Extracting Justifications from BioPortal Ontologies,Extracting Justifications from BioPortal Ontologies,d2dc5ef7dee38f0badae55065e6bcf5025c88cdd
1461,https://w3id.org/scholarlydata/inproceedings/iswc2012/proceedings-1/paper-36,ourSpaces - Design and Deployment of a Semantic Virtual Research Environment,ourSpaces - Design and Deployment of a Semantic Virtual Research Environment,7d3ee7d4cdc1756f8ee0eedbb56ab2888752b48a
1462,https://w3id.org/scholarlydata/inproceedings/iswc2012/proceedings-1/paper-10,A Multi-Domain Framework for Community Building Based on Data Tagging,A Multi-domain Framework for Community Building Based on Data Tagging,7ef54464a91f0b3397a51789da347e594ad9f5b3
1463,https://w3id.org/scholarlydata/inproceedings/iswc2012/proceedings-1/paper-31,A Comparison of Hard Filters and Soft Evidence for Answer Typing in Watson,A Comparison of Hard Filters and Soft Evidence for Answer Typing in Watson,bb073097f3fc39de684f648e0c86ae6a68844db2
1464,https://w3id.org/scholarlydata/inproceedings/iswc2012/proceedings-1/paper-37,Applying Semantic Web Technologies for Diagnosing Road Traffic Congestions,Applying Semantic Web Technologies for Diagnosing Road Traffic Congestions,34c986f74c9588c0380d2f0d7d3f84813bbb4a75
1465,https://w3id.org/scholarlydata/inproceedings/iswc2012/proceedings-1/paper-02,Quality Reasoning in the Semantic Web,Quality Reasoning in the Semantic Web,2d034b56f2f27c774a86c700286eef02bd042275
1466,https://w3id.org/scholarlydata/inproceedings/iswc2012/proceedings-1/paper-33,QuerioCity: A Linked Data Platform for Urban Information Management,QuerioCity: A Linked Data Platform for Urban Information Management,8966ffe3da1b472567d8052e84bfa13c369c8a27
1467,https://w3id.org/scholarlydata/inproceedings/iswc2012/proceedings-1/paper-01,Cross Lingual Semantic Search by Improving Semantic Similarity and Relatedness Measures,Cross Lingual Semantic Search by Improving Semantic Similarity and Relatedness Measures,ea225c769d28da3002c165b95b72d1273b3ae433
1468,https://w3id.org/scholarlydata/inproceedings/iswc2012/proceedings-1/paper-25,Embedded EL + Reasoning on Programmable Logic Controllers,Embedded EL + Reasoning on Programmable Logic Controllers,474cb95ff660329f436f6c6571e63197b3adde4c
1469,https://w3id.org/scholarlydata/inproceedings/iswc2012/proceedings-1/paper-28,Experiences with modeling composite phenotypes in the SKELETOME project,Experiences with modeling composite phenotypes in the SKELETOME project,adbf4aa54bc5c3ebcae5e30413c7c27efa7698de
1470,https://w3id.org/scholarlydata/inproceedings/iswc2012/proceedings-1/paper-26,Semantic Reasoning in Context-Aware Assistive Environments to Support Ageing with Dementia,Semantic Reasoning in Context-Aware Assistive Environments to Support Ageing with Dementia,13b38c7153769ef595ed8aa4cacbec2e00a82fe4
1471,https://w3id.org/scholarlydata/inproceedings/iswc2012/proceedings-1/paper-22,Evaluating Entity Summarization Using a Game-Based Ground Truth,Evaluating Entity Summarization Using a Game-Based Ground Truth,6d413e23277ec1c49163db46cf650fa93a94f1aa
1472,https://w3id.org/scholarlydata/inproceedings/iswc2012/poster-demo-proceedings/paper-16,Making Sense of Research with Rexplore,Making Sense of Research with Rexplore,9aaa2c963a503db23cf0155262e2f6d57e080a9d
1473,https://w3id.org/scholarlydata/inproceedings/iswc2012/poster-demo-proceedings/paper-17,MeDetect: Domain Entity Annotation in Biomedical References Using Linked Open Data,MeDetect: Domain Entity Annotation in Biomedical References Using Linked Open Data,12aa8d54156b8673d3190496ed6cf5f914f936d9
1474,https://w3id.org/scholarlydata/inproceedings/iswc2012/poster-demo-proceedings/paper-18,Mining Patterns from Clinical Trial Annotated Datasets by Exploiting the NCI Thesaurus,Mining Patterns from Clinical Trial Annotated Datasets by Exploiting the NCI Thesaurus,58bbb95a915ec9f6141bd42e9c959111beba5ebb
1475,https://w3id.org/scholarlydata/inproceedings/iswc2012/poster-demo-proceedings/paper-14,"Jena-HBase: A Distributed, Scalable and Effcient RDF Triple Store","Jena-HBase: A Distributed, Scalable and Effcient RDF Triple Store",adc2203cb744c280ec29c7d4ca4273eacda5f72e
1476,https://w3id.org/scholarlydata/inproceedings/iswc2012/poster-demo-proceedings/paper-15,Linked Data Fusion in ODCleanStore,Linked Data Fusion in ODCleanStore,ce82ff244b1d079d50e18acd968ff575c3996927
1477,https://w3id.org/scholarlydata/inproceedings/iswc2012/poster-demo-proceedings/paper-19,ourSpaces - A Semantic Virtual Research Environment,ourSpaces - A Semantic Virtual Research Environment,b0c7c0555bbd6e29bd6fe89cd5648dfc3018dc1c
1478,https://w3id.org/scholarlydata/inproceedings/iswc2012/poster-demo-proceedings/paper-12,Extracting Relevant Subgraphs from Graph Navigation,Extracting Relevant Subgraphs from Graph Navigation,792e3f40fec820824d5a032f36635dd6fb6436a2
1479,https://w3id.org/scholarlydata/inproceedings/iswc2012/poster-demo-proceedings/paper-13,INSTANS: High-Performance Event Processing with Standard RDF and SPARQL,INSTANS: High-Performance Event Processing with Standard RDF and SPARQL,ce1f5b093801b890ae7c2ca955820e755dee2764
1480,https://w3id.org/scholarlydata/inproceedings/iswc2012/poster-demo-proceedings/paper-10,DiscOU: A Flexible Discovery Engine for Open Educational Resources Using Semantic Indexing and Relationship Summaries,DiscOU: A Flexible Discovery Engine for Open Educational Resources Using Semantic Indexing and Relationship Summaries,461b4506f751c3a39ca55e95de027827db3d7dff
1481,https://w3id.org/scholarlydata/inproceedings/iswc2012/poster-demo-proceedings/paper-11,Everything is Connected: Using Linked Data for Multimedia Narration of Connections between Concepts,Everything is Connected: Using Linked Data for Multimedia Narration of Connections between Concepts,7b568fe96ee451cf04799e80d855f1860c209005
1482,https://w3id.org/scholarlydata/inproceedings/iswc2012/poster-demo-proceedings/paper-04,Browsing Causal Chains in a Disease Ontology,Browsing Causal Chains in a Disease Ontology,8151a9935f2082a5677698dcd825433d22d4a968
1483,https://w3id.org/scholarlydata/inproceedings/iswc2012/poster-demo-proceedings/paper-05,Building Large Scale Relation KB from Text,Building Large Scale Relation KB from Text,d623e55d5086d4becb17c6a29600e379f2caa538
1484,https://w3id.org/scholarlydata/inproceedings/iswc2012/poster-demo-proceedings/paper-06,Creating Enriched YouTube Media Fragments With NERD Using Timed-Text,Creating Enriched YouTube Media Fragments With NERD Using Timed-Text,66646f842f1981fb9119124ef5aef6aedb335846
1485,https://w3id.org/scholarlydata/inproceedings/iswc2012/poster-demo-proceedings/paper-02,Applying Multidimensional Navigation and Explanation in Semantic Dataset Summarization,Applying Multidimensional Navigation and Explanation in Semantic Dataset Summarization,84333bc7f92e1cbc56a02df1e8d0f65aeac8a152
1486,https://w3id.org/scholarlydata/inproceedings/iswc2012/poster-demo-proceedings/paper-03,A Prototype for Semantic based Diagnosis of Road Traffic Congestions,A Prototype for Semantic based Diagnosis of Road Traffic Congestions,8be91b339f86650ec74aaee965c92e38f38926a4
1487,https://w3id.org/scholarlydata/inproceedings/iswc2012/poster-demo-proceedings/paper-09,On Direct Debugging of Aligned Ontologies,On Direct Debugging of Aligned Ontologies,617402add1b23b449d1f88367045ea02918b929d
1488,https://w3id.org/scholarlydata/inproceedings/iswc2012/poster-demo-proceedings/paper-07,Demo: Efficient Human Attention Detection in Museums based on Semantics and Complex Event Processing,Demo: Efficient Human Attention Detection in Museums based on Semantics and Complex Event Processing,015f4d351e5a09f6cdc0e23017533ebafc19a0d1
1489,https://w3id.org/scholarlydata/inproceedings/iswc2012/poster-demo-proceedings/paper-08,Demonstrating Blank Node Matching and RDF/S Comparison Functions,Demonstrating Blank Node Matching and RDF/S Comparison Functions,d47aea86962ab3185a57a65e59e5c35f860320b7
1490,https://w3id.org/scholarlydata/inproceedings/iswc2012/poster-demo-proceedings/paper-01,Adding Realtime Coverage to the Google Knowledge Graph,Adding Realtime Coverage to the Google Knowledge Graph,687fa8193a62975da0ad995e2fe6432e3b4160c9
1491,https://w3id.org/scholarlydata/inproceedings/iswc2010/paper/259,OWL-POLAR: Semantic Policies for Agent Reasoning,OWL-POLAR: Semantic Policies for Agent Reasoning,e25920cf900c12065c8da7920e10eae7a0f4e0ca
1492,https://w3id.org/scholarlydata/inproceedings/iswc2010/paper/126,Assessing Trust in Uncertain Information,Assessing Trust in Uncertain Information,03c6def564cc2cec44d01dc97046da9c9831292c
1493,https://w3id.org/scholarlydata/inproceedings/iswc2010/paper/127,Forgetting Fragments from Evolving Ontologies,Forgetting Fragments from Evolving Ontologies,e4aeb9f91965bd9180e3e515c925aba8a24baf54
1494,https://w3id.org/scholarlydata/inproceedings/iswc2010/paper/463,Semantic-based Complex Event Processing in the AAL Domain,Semantic-based Complex Event Processing in the AAL Domain,14ce0d496c776224ae4c462cade66dae91868a34
1495,https://w3id.org/scholarlydata/inproceedings/iswc2010/paper/456,MoKi: aWiki-Based Conceptual Modeling Tool,MoKi: a Wiki-Based Conceptual Modeling Tool,941ee7482956ab5f1c16b365e51e82b23dfcaa65
1496,https://w3id.org/scholarlydata/inproceedings/iswc2010/paper/484,RDOTE - Transforming Relational Databases into Semantic Web Data,RDOTE - Transforming Relational Databases into Semantic Web Data,3df3dc730de898ac6a5aacf7227389da96bcb7e1
1497,https://w3id.org/scholarlydata/inproceedings/iswc2010/paper/192,JustBench: A Framework for OWL Benchmarking,JustBench: A Framework for OWL Benchmarking,a15ab4cbfef52c1023c8764ecf34b303c61a3dd3
1498,https://w3id.org/scholarlydata/inproceedings/iswc2010/paper/334,Linking and Building Ontologies of Linked Data,Linking and Building Ontologies of Linked Data,4ff1484a56b6bca386f2660c554ffe7bea93bf28
1499,https://w3id.org/scholarlydata/inproceedings/iswc2010/paper/520,Hybrid Graph based Keyword Query Interpretation on RDF,Hybrid Graph based Keyword Query Interpretation on RDF,44d6a82fc77e3c7d962240583616ca4ba73013ed
1500,https://w3id.org/scholarlydata/inproceedings/iswc2010/paper/422,ISReal: An Open Platform for Semantic-Based 3D Simulations in the 3D Internet,ISReal: An Open Platform for Semantic-Based 3D Simulations in the 3D Internet,359b48b651b4f1e6403c795f251a7250a2f68ae3
1501,https://w3id.org/scholarlydata/inproceedings/iswc2010/paper/125,Optimizing Enterprise-scale OWL 2 RL Reasoning in a Relational Database System,Optimizing Enterprise-Scale OWL 2 RL Reasoning in a Relational Database System,1d4b5b88bbed3b1bd5333bb2d031a5e780883cfe
1502,https://w3id.org/scholarlydata/inproceedings/iswc2010/paper/476,Enterprise Data Classification Using Semantic Web Technologies,Enterprise Data Classification Using Semantic Web Technologies,4a0110b7e1b8c8f4231bf1337491a4d75f8ea58d
1503,https://w3id.org/scholarlydata/inproceedings/iswc2010/paper/489,T2LD: Interpreting and Representing Tables as Linked Data,T2LD: Interpreting and Representing Tables as Linked Data,d252e3f7f118ff97b3e752126f59d12cf5fb7b4b
1504,https://w3id.org/scholarlydata/inproceedings/iswc2010/paper/529,A Semantic Web Repository for Managing and Querying Aligned Knowledge,A Semantic Web Repository for Managing and Querying Aligned Knowledge,93a2036e9ea8a9d8e0ea74dc0f2697dd76ef6e79
1505,https://w3id.org/scholarlydata/inproceedings/iswc2010/paper/261,When owl:sameAs isn't the Same: An Analysis of Identity in Linked Data,When owl: sameAs Isn't the Same: An Analysis of Identity in Linked Data,4359bd61412e6c9fd667cb451354eb8c15341def
1506,https://w3id.org/scholarlydata/inproceedings/iswc2010/paper/318,SameAs Networks and Beyond: Analyzing Deployment Status and Implications of owl:sameAs in Linked Data,SameAs Networks and Beyond: Analyzing Deployment Status and Implications of owl: sameAs in Linked Data,8ffcfda64f697e90d7e0aea79dbe81975dec4562
1507,https://w3id.org/scholarlydata/inproceedings/iswc2010/paper/247,Linkage of Heterogeneous Knowledge Resources within In-store Dialogue Interaction,Linkage of Heterogeneous Knowledge Resources within In-Store Dialogue Interaction,e3ea9c71e386f118a57addb01a5d5ad4c79e392f
1508,https://w3id.org/scholarlydata/inproceedings/iswc2010/paper/317,Deciding Agent Orientation on Ontology Mappings,Deciding Agent Orientation on Ontology Mappings,e9fb7d3b1320b26643cdbf7889bfe66662381062
1509,https://w3id.org/scholarlydata/inproceedings/iswc2010/paper/496,Demo: Enriching Text with RDF/OWL Encoded Senses,Demo: Enriching Text with RDF/OWL Encoded Senses,10fca9ad8cc360bec438f009e2e38f986e687d98
1510,https://w3id.org/scholarlydata/inproceedings/iswc2010/paper/301,Using Reformulation Trees to Optimize Queries over Distributed Heterogeneous Sources,Using Reformulation Trees to Optimize Queries over Distributed Heterogeneous Sources,af6df08dc32f90aba81e580e961182ef92372f18
1511,https://w3id.org/scholarlydata/inproceedings/iswc2010/paper/499,RightField: Embedding Ontology Term Selection into Spreadsheets for the Annotation of Biological Data,Rightfield: Embedding Ontology Term Selection into Spreadsheets for the Annotation of Biological Data,ed1d11dce7f6f3f2d836e6c8757cfe7474ec8a58
1512,https://w3id.org/scholarlydata/inproceedings/iswc2010/paper/479,Semantic-based Mobile Mashup Platform,Semantic-based Mobile Mashup Platform,aecb1139489aafa8d5b8dc9225a8aeecb06d8bf4
1513,https://w3id.org/scholarlydata/inproceedings/iswc2010/paper/144,SPARQL Query Optimization on Top of DHTs,SPARQL Query Optimization on Top of DHTs,4437b40ebff841ea990928078ac3769d0751da7a
1514,https://w3id.org/scholarlydata/inproceedings/iswc2010/paper/460,Visualizing Populated Ontologies with OntoTrix,Visualizing Populated Ontologies with OntoTrix,c4b3e4307092d15a0c39a06d4a22468b7951b628
1515,https://w3id.org/scholarlydata/inproceedings/iswc2010/paper/431,dbrec - Music Recommendations Using DBpedia,dbrec - Music Recommendations Using DBpedia,dfd3696827abcaca0192224033cc963327825d13
1516,https://w3id.org/scholarlydata/inproceedings/iswc2010/paper/515,Building Linked Data Applications with Fusion: A Visual Interface for Exploration and Mapping,Building Linked Data Applications with Fusion: A Visual Interface for Exploration and Mapping,6f2ebf632dd1ba14c7f779d88f5e77403a548c42
1517,https://w3id.org/scholarlydata/inproceedings/iswc2010/paper/436,Fusion - Visually Exploring and Eliciting Relationships in Linked Data,Fusion - Visually Exploring and Eliciting Relationships in Linked Data,66f24184d4cebe04a49a72dfaf91a71f6aaa5218
1518,https://w3id.org/scholarlydata/inproceedings/iswc2010/paper/307,Declarative Semantics for the Rule Interchange Format Production Rule Dialect,Declarative Semantics for the Rule Interchange Format Production Rule Dialect,09c040e06ebdcec758ae3c98932fa87c20290db3
1519,https://w3id.org/scholarlydata/inproceedings/iswc2010/paper/84,Talking about Data: Sharing Richly Structured Information through Blogs and Wikis,Talking about Data: Sharing Richly Structured Information through Blogs and Wikis,d7032c44b5b994be08d33336e69371fcf64f4731
1520,https://w3id.org/scholarlydata/inproceedings/iswc2010/paper/468,A web-based Evaluation Service for Ontology Matching,A Web-based Evaluation Service for Ontology Matching,2203e446fa9774880a425824beb89f83a014eb13
1521,https://w3id.org/scholarlydata/inproceedings/iswc2010/paper/432,Causal Knowledge Modeling for Traditional Chinese Medicine using OWL 2,Causal Knowledge Modeling for Traditional Chinese Medicine using OWL 2,ee27a49c588ed05c665f03c3d00d81a344b79d5a
1522,https://w3id.org/scholarlydata/inproceedings/iswc2010/paper/432,Causal Knowledge Modeling for Traditional Chinese Medicine using OWL 2,Causal Knowledge Modeling for Traditional Chinese Medicine Using OWL 2,d83cf2fe40696bb3d8573de46e3c21579badd73a
1523,https://w3id.org/scholarlydata/inproceedings/iswc2010/paper/304,Preference-based Web Service Composition: A Middle Ground Between Execution and Search,Preference-Based Web Service Composition: A Middle Ground between Execution and Search,b2d4fe0727ac9e75987d8646881a38d6137df496
1524,https://w3id.org/scholarlydata/inproceedings/iswc2010/paper/532,The Catalogus Professorum Lipsiensis - Semantics-based Collaboration and Exploration for Historians,The Catalogus Professorum Lipsiensis - Semantics-based Collaboration and Exploration for Historians,f82f9f60f809c728eb388100fc8ec85afff74455
1525,https://w3id.org/scholarlydata/inproceedings/iswc2010/paper/385,I18n of Semantic Web Applications,I18n of Semantic Web Applications,a6127f765e0321a4025c035bf6568b3cd812453b
1526,https://w3id.org/scholarlydata/inproceedings/iswc2010/paper/386,Knowledge Engineering for Historians on the Example of the Catalogus Professorum Lipsiensis,Knowledge Engineering for Historians on the Example of the Catalogus Professorum Lipsiensis,54719aa4b095c9b826f6f7f225f0a632032bd5ff
1527,https://w3id.org/scholarlydata/inproceedings/iswc2010/paper/241,EvoPat - Pattern-Based Evolution and Refactoring of RDF Knowledge Bases,EvoPat - Pattern-Based Evolution and Refactoring of RDF Knowledge Bases,ba026219b5c98d6bcff02f18ebcee543d269d8e8
