,uri,tituloOriginal,tituloExtraido,codigo
2066,https://w3id.org/scholarlydata/inproceedings/swws2001/proceedings/paper-34,UML and the Semantic Web,UML and the Semantic Web,277001386b8cb2232f8564d62d5e928b68db5409
2067,https://w3id.org/scholarlydata/inproceedings/swws2001/proceedings/paper-26,Overcoming Ontology Mismatches in Transactions with Self-Describing Service Agents,Overcoming Ontology Mismatches in Transactions with Self-Describing Service Agents,163a31983257edbfb260e2332ffc2da8f5536ce7
2068,https://w3id.org/scholarlydata/inproceedings/swws2001/proceedings/paper-32,"The Semantic Web As ""Perfection Seeking"": A View from Drug Terminology","The Semantic Web As ""Perfection Seeking"": A View from Drug Terminology",59c6a91fdbf12de3b7c4b3e550a8e5338218c9a6
2069,https://w3id.org/scholarlydata/inproceedings/swws2001/proceedings/paper-13,Development of a Simple Ontology Definition Language (SOntoDL) and Its Application to a Medical Information Service on the World Wide Web,Development of a Simple Ontology Definition Language (SOntoDL) and Its Application to a Medical Information Service on the World Wide Web,049601f9d66098ca8c04ad4574f212ffd6d65c7d
2070,https://w3id.org/scholarlydata/inproceedings/swws2001/proceedings/paper-19,Object Interoperability for Geospatial Applications,Object Interoperability for Geospatial Applications,07196a1e1b03cd7447aefa4bb6cb153a64801c7e
2071,https://w3id.org/scholarlydata/inproceedings/swws2001/proceedings/paper-25,Open Learning Repositories and Metadata Modeling,Open Learning Repositories and Metadata Modeling,7f4e1c6069d9e52e7f92c662aaf4095d0f5f7a27
2072,https://w3id.org/scholarlydata/inproceedings/swws2001/proceedings/paper-18,Metamodeling Architecture of Web Ontology Languages,Metamodeling Architecture of Web Ontology Languages,ac30267ef17be7ae50da38e13e3042c5f93f0bd4
2073,https://w3id.org/scholarlydata/inproceedings/swws2001/proceedings/paper-17,ITTALKS: A Case Study in the Semantic Web and DAML,ITTALKS: A Case Study in the Semantic Web and DAML,14a05832b00e52db77d2591aaef26009461ba6ca
2074,https://w3id.org/scholarlydata/inproceedings/swws2001/proceedings/paper-24,OntoWebber: Model-Driven Ontology-Based Web Site Management,OntoWebber: Model-Driven Ontology-Based Web Site Management,296eca177e6e868480ad9e8bb8b2c812e3bdfc0e
2075,https://w3id.org/scholarlydata/inproceedings/swws2001/proceedings/paper-29,Serching for services on the semantic web using process ontologies,Serching for services on the semantic web using process ontologies,04f8782f703e6f1f03013c368f826b9ebd75c5eb
2076,https://w3id.org/scholarlydata/inproceedings/swws2001/proceedings/paper-12,Design Rationale for RuleML: A Markup Language for Semantic Web Rules,Design Rationale for RuleML: A Markup Language for Semantic Web Rules,0cc203a2871f6411e7d2323402a15d5335b5fb65
2077,https://w3id.org/scholarlydata/inproceedings/swws2001/proceedings/paper-28,Semantic Web Modeling and Programming with XDD,Semantic Web Modeling and Programming with XDD,394e01ad2d0a58684e8009b8babbd8f364aed762
2078,https://w3id.org/scholarlydata/inproceedings/swws2001/position-proceedings/paper-34,The Conceptual Web - our research vision,The Conceptual Web - our research vision,45894201208d2b232a1dc2d1d18b1ed53b17ef96
2079,https://w3id.org/scholarlydata/inproceedings/swws2001/position-proceedings/paper-31,Description Logics Emerge from Ivory Towers,Description Logics Emerge from Ivory Towers,8d0be0eb69ab360ff0180db9b126a8799b35795f
2080,https://w3id.org/scholarlydata/inproceedings/swws2001/position-proceedings/paper-07,Extension of RDF(S) with Contextual and Definitional Knowledge,Extension of RDF(S) with Contextual and Definitional Knowledge,b6ebd5c3aa7018d8e5a0fde5fcc5cbbfafb76c27
2081,https://w3id.org/scholarlydata/inproceedings/swws2001/position-proceedings/paper-04,The PIA Project: Learning to Semantically Annotate Texts from an Ontology and XMLInstance Data,The PIA Project: Learning to Semantically Annotate Texts from an Ontology and XML-Instance Data,7b0d261b6835e5178e51baef6e3176bdb46d718a
2082,https://w3id.org/scholarlydata/inproceedings/swws2001/position-proceedings/paper-45,Semantics for Multimedia on the Web,Semantics for Multimedia on the Web,067042f6f246e4bc5d322abdeb8fbeda4f6e3f76
2083,https://w3id.org/scholarlydata/inproceedings/swws2001/position-proceedings/paper-16,A proposal of infra-structural needs on the framework of the Semantic Web for ontology construction and use,A proposal of infra-structural needs on the framework of the Semantic Web for ontology construction and use 1,ee1c97b2abcb2f4fec2c2b359671a527ed08920a
2084,https://w3id.org/scholarlydata/inproceedings/swws2001/position-proceedings/paper-15,Creating the Semantic Web: the Role of an Agricultural Ontology Server(AOS),Creating the Semantic Web: the Role of an Agricultural Ontology Server (AOS),1f7b34fb4933bafbda048b324a58fe25a0723435
2085,https://w3id.org/scholarlydata/inproceedings/swws2001/position-proceedings/paper-12,Logics for the Semantic Web,Logics for the Semantic Web,1e8dcd5ce1855f7e92379e838352b3bc84c9ac53
2086,https://w3id.org/scholarlydata/inproceedings/swws2001/position-proceedings/paper-12,Logics for the Semantic Web,Logics for the Semantic Web,fb563350008eea0218009e217576212a397ab333
2087,https://w3id.org/scholarlydata/inproceedings/swws2001/position-proceedings/paper-13,Ontologies: Dynamic Networks of Formally Represented Meaning,Ontologies: Dynamic Networks of Formally Represented Meaning,63610a172a7aded672da2440c0ff22615adf9306
2088,https://w3id.org/scholarlydata/inproceedings/iswc2004/poster-proceedings/paper-07,Educational Topic Maps,Educational Topic Maps,e0d68305556e718902e484d6589c978dec396b66
2089,https://w3id.org/scholarlydata/inproceedings/iswc2004/poster-proceedings/paper-08,Description of an Instructional Ontology and its Application in Web Services for Education,Description of an Instructional Ontology and its Application in Web Services for Education,67dd561e6ac13d081e1eada4ddd9ffc7f61ace68
2090,https://w3id.org/scholarlydata/inproceedings/iswc2004/poster-proceedings/paper-09,Mining for Content Re-Use and Exchange -- Solutions and Problems,Mining for Content Re-Use and Exchange -- Solutions and Problems*,5d746f95b821effb4a6c9845f0d3199005b2263c
2091,https://w3id.org/scholarlydata/inproceedings/iswc2004/demo-proceedings/paper-19,Competence Manager Applying the Semantic Web in Practice,Competence Manager — Applying the Semantic Web in Practice,620ae40bbb9305e05ea84f222cea4352b7d893b8
2092,https://w3id.org/scholarlydata/inproceedings/iswc2004/proceedings/paper-19,Extending the RDFS Entailment Lemma,Extending the RDFS Entailment Lemma,f8adf37472015bb9271bec221488699ab08a69d3
2093,https://w3id.org/scholarlydata/inproceedings/iswc2004/proceedings/paper-18,Contexts for the Semantic Web,Contexts for the Semantic Web,d40f82c46ec4d789bd1ad652aca63c8017d0781d
2094,https://w3id.org/scholarlydata/inproceedings/iswc2004/demo-proceedings/paper-18,Annotating the Legacy Web with Lixto,Annotating the Legacy Web with Lixto,c11b3faa4553ad226137bc9a8eaa3c4f978d7d7f
2095,https://w3id.org/scholarlydata/inproceedings/iswc2004/demo-proceedings/paper-15,Xcerpt and visXcerpt: Twin Query Languages for the Semantic Web,Xcerpt and visXcerpt: Twin Query Languages for the Semantic Web,df98f90d3e0747c175b5521edb4a1015c0c69eb8
2096,https://w3id.org/scholarlydata/inproceedings/iswc2004/proceedings/paper-15,Automating Scientific Experiments on the Semantic Grid,Automating Scientific Experiments on the Semantic Grid,73287e87fd4cdcb3cfd9e8467295b2d43f43e144
2097,https://w3id.org/scholarlydata/inproceedings/iswc2004/proceedings/paper-57,Working with Multiple Ontologies on the Semantic Web,Working with Multiple Ontologies on the Semantic Web,476a2963b2f68a06e7e4bedfdd844d4f4bb3cf50
2098,https://w3id.org/scholarlydata/inproceedings/iswc2004/proceedings/paper-05,An API for Ontology Alignment,An API for Ontology Alignment,fc632c074efce8b528d65ccdc7c2cec7ba181620
2099,https://w3id.org/scholarlydata/inproceedings/iswc2004/proceedings/paper-04,A Model Theoretic Semantics for Ontology Versioning,A Model Theoretic Semantics for Ontology Versioning,026899ffb99575dbc3e214c171334a4e21ec0b6c
2100,https://w3id.org/scholarlydata/inproceedings/iswc2004/proceedings/paper-01,A Comparison of RDF Query Languages,A Comparison of RDF Query Languages,d61ed514fa179782d3703a7ec3a2d7e0abf2b686
2101,https://w3id.org/scholarlydata/inproceedings/iswc2004/proceedings/paper-01,A Comparison of RDF Query Languages,A Comparison of RDF Query Languages,a39d928f2883cb091b3bae5adfc77134e3e979a3
2102,https://w3id.org/scholarlydata/inproceedings/iswc2004/proceedings/paper-41,Rules-By-Example - A Novel Approach to Semantic Indexing and Querying of Images,Rules-By-Example - A Novel Approach to Semantic Indexing and Querying of Images,e445b2b048b82cd1031428abd864b5a834a52816
2103,https://w3id.org/scholarlydata/inproceedings/iswc2004/proceedings/paper-14,Automatic Generation of Ontology for Scholarly Semantic Web,Automatic Generation of Ontology for Scholarly Semantic Web,1564944ed915875071efb79ff3b12be63da21e67
2104,https://w3id.org/scholarlydata/inproceedings/iswc2004/proceedings/paper-28,Knowledge-Intensive Induction of Terminologies from Metadata,Knowledge-Intensive Induction of Terminologies from Metadata,f3d079fb7f21bb870ac1eaf33f1c3ce4e4c920f4
2105,https://w3id.org/scholarlydata/inproceedings/iswc2004/proceedings/paper-40,Querying Real World Services Through the Semantic Web,Querying Real World Services Through the Semantic Web,85e0c48b099505fe19c13a318abfd10abc3b0315
2106,https://w3id.org/scholarlydata/inproceedings/iswc2004/proceedings/paper-10,Applying Semantic Web Technology to the Life Cycle Support of Complex Engineering Assets,Applying Semantic Web Technology to the Life Cycle Support of Complex Engineering Assets,38fac5d96f13032be590fceb9e0b46faa6d3e93e
2107,https://w3id.org/scholarlydata/inproceedings/iswc2004/proceedings/paper-24,How to Build Google2Google - An (Incomplete) Recipe,How to Build Google2Google - An (Incomplete) Recipe,f829413e4633e246f32f258a6bc6c8c994494521
2108,https://w3id.org/scholarlydata/inproceedings/iswc2004/proceedings/paper-50,Top-k Query Evaluation for Schema-Based Peer-to-Peer Networks,Top-k Query Evaluation for Schema-Based Peer-to-Peer Networks,9f29c90ab38faf62a3ad5c2e50987fba03d14277
2109,https://w3id.org/scholarlydata/inproceedings/iswc2004/proceedings/paper-39,Query Answering for OWL-DL with Rules,Query Answering for OWL-DL with Rules,d507279bcc3ee86c1a22430e96bf52071c48c6b0
2110,https://w3id.org/scholarlydata/inproceedings/iswc2004/proceedings/paper-39,Query Answering for OWL-DL with Rules,Query Answering for OWL-DL with rules,19f44e6a7ef68141088930e650a2a5d90d379a4c
2111,https://w3id.org/scholarlydata/inproceedings/iswc2004/proceedings/paper-39,Query Answering for OWL-DL with Rules,Query Answering for OWL-DL with rules,6e827d64311d9486b51a0f6c22184ace26ac3bcf
2112,https://w3id.org/scholarlydata/inproceedings/iswc2004/proceedings/paper-35,ORIENT: Integrate Ontology Engineering into Industry Tooling Environment,ORIENT: Integrate Ontology Engineering into Industry Tooling Environment,75401f5eca4080d924dbe0c361f96570ed77c17e
2113,https://w3id.org/scholarlydata/inproceedings/iswc2004/proceedings/paper-06,An Evaluation of Knowledge Base Systems for Large OWL Datasets,An Evaluation of Knowledge Base Systems for Large OWL Datasets,7f3a927d85a32138312e04bb21ff3f1c6c388b57
2114,https://w3id.org/scholarlydata/inproceedings/iswc2004/proceedings/paper-09,"Applying Semantic Web Services to Bioinformatics: Experiences Gained, Lessons Learnt","Applying Semantic Web Services to Bioinformatics: Experiences Gained, Lessons Learnt",0979d194d1dee8fc3ebc55b1360f4759dd8ca081
2115,https://w3id.org/scholarlydata/inproceedings/iswc2004/proceedings/paper-08,Applying KAoS Services to Ensure Policy Compliance for Semantic Web Services Workflow Composition and Enactment,Applying KAoS Services to Ensure Policy Compliance for Semantic Web Services Workflow Composition and Enactment,a69acee960d7430c95ede270e486724eaf80aa13
2116,https://w3id.org/scholarlydata/inproceedings/iswc2004/proceedings/paper-49,The Specification of Agent Behavior by Ordinary People: A Case Study,The Specification of Agent Behavior by Ordinary People: A Case Study,c2eb9e613466590a0460b3a30fed8e1283dc18b0
2117,https://w3id.org/scholarlydata/inproceedings/iswc2004/proceedings/paper-48,The Protégé OWL Plugin: An Open Development Environment for Semantic Web Applications,The Protégé OWL Plugin: An Open Development Environment for Semantic Web Applications,bc789dd9732d7b3a64cea5c880b0651bd3827915
2118,https://w3id.org/scholarlydata/inproceedings/iswc2004/proceedings/paper-02,A Conceptual Architecture for Semantic Web Services,A Conceptual Architecture for Semantic Web Services,a91b329092a9373dbf5b730a57aedbe86d31db0d
2119,https://w3id.org/scholarlydata/inproceedings/iswc2004/proceedings/paper-42,SemanticOrganizer: A Customizable Semantic Repository for Distributed NASA Project Teams,SemanticOrganizer: A Customizable Semantic Repository for Distributed NASA Project Teams,03621f504a471376f70cf737b51248117d97f19c
2120,https://w3id.org/scholarlydata/inproceedings/iswc2004/proceedings/paper-45,Specifying Ontology Views by Traversal,Specifying Ontology Views by Traversal,eb42c21bda9fe6fa690c19c0d4aa4df6988f3ee5
2121,https://w3id.org/scholarlydata/inproceedings/iswc2004/proceedings/paper-44,Small Can Be Beautiful in the Semantic Web,Small Can Be Beautiful in the Semantic Web,090170e8e2bb3b49a7c1f3cbd3ae839ad7ae17fa
2122,https://w3id.org/scholarlydata/inproceedings/iswc2004/proceedings/paper-54,Using Vampire to Reason with OWL,Using Vampire to Reason with OWL,f316538a8a2306cc2f8cbff354565b9ec0fc17ec
2123,https://w3id.org/scholarlydata/inproceedings/iswc2004/proceedings/paper-11,A Semantic Web Resource Protocol: XPointer and HTTP,A Semantic Web Resource Protocol: XPointer and HTTP,35058e811f876082c29966e895350946a513441c
2124,https://w3id.org/scholarlydata/inproceedings/iswc2004/proceedings/paper-51,Towards a Symptom Ontology for Semantic Web Applications,Towards a Symptom Ontology for Semantic Web Applications,12c2e3694c6dd499f096d4d483a55e622e75ea86
2125,https://w3id.org/scholarlydata/inproceedings/iswc2004/proceedings/paper-16,Bibster - A Semantics-Based Bibliographic Peer-to-Peer System,Bibster - A Semantics-Based Bibliographic Peer-to-Peer System,a7fd1c847e70c9c1c020812b7e75a804707356ec
2126,https://w3id.org/scholarlydata/inproceedings/iswc2004/proceedings/paper-16,Bibster - A Semantics-Based Bibliographic Peer-to-Peer System,Bibster - A Semantics-Based Bibliographic Peer-to-Peer System,685620d8157b5d219fcbfc24702d3c046db4bcf1
2127,https://w3id.org/scholarlydata/inproceedings/iswc2004/proceedings/paper-25,Inferring Data Transformation Rules to Integrate Semantic Web Services,Inferring Data Transformation Rules to Integrate Semantic Web Services,ef59ec293a2937017c8735b1208564a7c3a432f1
2128,https://w3id.org/scholarlydata/inproceedings/iswc2004/proceedings/paper-46,Structure-Based Partitioning of Large Concept Hierarchies,Structure-Based Partitioning of Large Concept Hierarchies,0df1b7b55849e98500ade94e38da746afb8de6f1
2129,https://w3id.org/scholarlydata/inproceedings/iswc2004/proceedings/paper-12,ASSAM: A Tool for Semi-automatically Annotating Semantic Web Services,ASSAM: A Tool for Semi-automatically Annotating Semantic Web Services,449030fac9f669e668bbed43376e7cb642fc3634
2130,https://w3id.org/scholarlydata/inproceedings/iswc2004/proceedings/paper-21,From Tables to Frames,From Tables to Frames,942bd1e78d166b7aadb2e43002b3730c005f6685
2131,https://w3id.org/scholarlydata/inproceedings/iswc2004/proceedings/paper-52,Tracking Changes During Ontology Evolution,Tracking Changes During Ontology Evolution,ec397b237fd68129d314cb5febd720a14abdf049
2132,https://w3id.org/scholarlydata/inproceedings/iswc2004/proceedings/paper-55,Visual Modeling of OWL DL Ontologies Using UML,Visual Modeling of OWL DL Ontologies Using UML,b3e88e67748e08ffc4c09975536bca9b168d8439
2133,https://w3id.org/scholarlydata/inproceedings/iswc2004/proceedings/paper-36,Patching Syntax in OWL Ontologies,Patching Syntax in OWL Ontologies,b1b2f8a085db8ff99726265e09dee8838d4b1aed
2134,https://w3id.org/scholarlydata/inproceedings/iswc2004/proceedings/paper-30,Metadata-Driven Personal Knowledge Publishing,Metadata-Driven Personal Knowledge Publishing,862f32a1a94ecbea16e13a17b06a2b2bf578b895
2135,https://w3id.org/scholarlydata/inproceedings/iswc2004/proceedings/paper-27,Information Retrieval Support for Ontology Construction and Use,Information Retrieval Support for Ontology Construction and Use,1d5bd4b2a4dadbcd7f1bc254ec5061e96d161bca
2136,https://w3id.org/scholarlydata/inproceedings/iswc2004/proceedings/paper-26,Information Gathering During Planning for Web Service Composition,Information Gathering During Planning for Web Service Composition,7588c252c5d5c0445d0a144bb6b50e844c9fd865
2137,https://w3id.org/scholarlydata/inproceedings/iswc2004/proceedings/paper-32,OntoTrack: Combining Browsing and Editing with Reasoning and Explaining for OWL Lite Ontologies,OntoTrack: Combining Browsing and Editing with Reasoning and Explaining for OWL Lite Ontologies,7e7ef0789ba77072d282fde44c815fadd9cc6e9a
2138,https://w3id.org/scholarlydata/inproceedings/iswc2004/proceedings/paper-29,Learning Meta-descriptions of the FOAF Network,Learning Meta-descriptions of the FOAF Network,dbd5865f08f8eece510668158d2db961ad6f7c82
2139,https://w3id.org/scholarlydata/inproceedings/iswc2004/proceedings/paper-23,GridVine: Building Internet-Scale Semantic Overlay Networks,GridVine: Building Internet-Scale Semantic Overlay Networks,3e71188c309e4c707d36ee96cd4449161bba7ce0
2140,https://w3id.org/scholarlydata/inproceedings/iswc2004/proceedings/paper-22,Generating On the Fly Queries for the Semantic Web: The ICS-FORTH Graphical RQL Interface (GRQL),Generating On the Fly Queries for the Semantic Web: The ICS-FORTH Graphical RQL Interface (GRQL),f5856aee038842e8b5657ed83ecfbb750e6c6d4c
2141,https://w3id.org/scholarlydata/inproceedings/iswc2004/proceedings/paper-56,What Would It Mean to Blog on the Semantic Web?,What Would It Mean to Blog on the Semantic Web?,e55398da07dfa48ace4be3a7075921a4a4fcd00e
2142,https://w3id.org/scholarlydata/inproceedings/iswc2004/proceedings/paper-17,Bipartite Graphs as Intermediate Model for RDF,Bipartite Graphs as Intermediate Model for RDF,633c62e24f704f40b2e05a008635b795c89609bb
2143,https://w3id.org/scholarlydata/inproceedings/iswc2004/proceedings/paper-13,Automated Composition of Semantic Web Services into Executable Processes,Automated Composition of Semantic Web Services into Executable Processes,9dfee513952d1d0d39df6a46b04e0fd7d42f9c4e
2144,https://w3id.org/scholarlydata/inproceedings/iswc2004/proceedings/paper-53,Using Semantic Web Technologies for Representing E-science Provenance,Using Semantic Web Technologies for Representing E-science Provenance,e22be58e31acc75024b8a83e8b6ddc00389d179a
2145,https://w3id.org/scholarlydata/inproceedings/iswc2004/proceedings/paper-07,An Extensible Directory Enabling Efficient Semantic Web Service Integration,An Extensible Directory Enabling Efficient Semantic Web Service Integration,07fe4353409bc287f76d514f26210c1d6c2f05d7
2146,https://w3id.org/scholarlydata/inproceedings/iswc2004/proceedings/paper-38,QOM - Quick Ontology Mapping,QOM - Quick Ontology Mapping,d054484307d3510f175383f7bc6ed4addbe63695
2147,https://w3id.org/scholarlydata/inproceedings/iswc2004/proceedings/paper-47,SWS for Financial Overdrawn Alerting,SWS for Financial Overdrawn Alerting,4a079a0999531f0dac67dcaccafc2ecd053c1f1b
2148,https://w3id.org/scholarlydata/inproceedings/iswc2004/proceedings/paper-34,Opening Up Magpie via Semantic Services,Opening Up Magpie via Semantic Services,eb42774724f6e7176f057e56c76f53442f658270
2149,https://w3id.org/scholarlydata/inproceedings/iswc2004/proceedings/paper-43,Semantic Web Service Interaction Protocols: An Ontological Approach,Semantic Web Service Interaction Protocols: An Ontological Approach,c47965f54f388190774493c30029111eb64aa03e
2150,https://w3id.org/scholarlydata/inproceedings/iswc2004/proceedings/paper-20,From Software APIs to Web Service Ontologies: A Semi-automatic Extraction Method,From Software APIs to Web Service Ontologies: A Semi-automatic Extraction Method,60a1f6f645770108b471ed6391c7e7b119b035a0
2151,https://w3id.org/scholarlydata/inproceedings/iswc2004/proceedings/paper-37,Public Deployment of Semantic Service Matchmaker with UDDI Business Registry,Public Deployment of Semantic Service Matchmaker with UDDI Business Registry,ed8b27dc4d2993f6f0443185b7e0a6dd4bab634a
2152,https://w3id.org/scholarlydata/inproceedings/iswc2004/proceedings/paper-31,On the Emergent Semantic Web and Overlooked Issues,On the Emergent Semantic Web and Overlooked Issues,59e0f871bad171fe1431f4ea6582b4f12ce4545f
2153,https://w3id.org/scholarlydata/inproceedings/iswc2004/proceedings/paper-33,OntoViews - A Tool for Creating Semantic Web Portals,OntoViews - A Tool for Creating Semantic Web Portals,682816e26e3e83598e58a5bc3913f231fcbf1446
2154,https://w3id.org/scholarlydata/inproceedings/iswc2004/demo-proceedings/paper-16,OntoSelect: A Dynamic Ontology Library with Support for Ontology Selection,OntoSelect: A Dynamic Ontology Library with Support for Ontology Selection,29628a5a63ee1d26eb0d23d3cba7c475c28bf64a
2155,https://w3id.org/scholarlydata/inproceedings/iswc2004/demo-proceedings/paper-12,Automatic Semantic Annotation with KIM,Automatic Semantic Annotation with KIM,2e345658d18186af4d6045559890a0f46837849e
2156,https://w3id.org/scholarlydata/inproceedings/iswc2004/demo-proceedings/paper-13,Advanced search and browsing in digital libraries,Advanced search and browsing in digital libraries,f6d9f8fe6b5a059843a285bc2e7ef4132b1622cf
2157,https://w3id.org/scholarlydata/inproceedings/iswc2004/demo-proceedings/paper-14,RDF and Topic Maps Interoperability in Practice,RDF and Topic Maps Interoperability in Practice,9886d3b1c51ed88498a79fd3e47a123d2892af5d
2158,https://w3id.org/scholarlydata/inproceedings/iswc2004/demo-proceedings/paper-10,Bringing Discussion to Documents for the Creation of Richer Metadata,Bringing Discussion to Documents for the Creation of Richer Metadata,23e0c5f440af67ac9a1c1b61daa3ba7b4eb27938
2159,https://w3id.org/scholarlydata/inproceedings/iswc2004/demo-proceedings/paper-11,OntoLT Version 1.0: Middleware for Ontology Extraction from Text,OntoLT Version 1 . 0 : Middleware for Ontology Extraction from Text,b38d4838e1dfc40c1baa4bbca34182595a6f8b41
2160,https://w3id.org/scholarlydata/inproceedings/iswc2004/poster-proceedings/paper-40,WSIRD: Web Services Integration via Rules for Data Transformation,WSIRD : Web Services Integration via Rules for Data Transformation,0f82fa7f9c07f73fa6f9e48e975e3528e2091fcc
2161,https://w3id.org/scholarlydata/inproceedings/iswc2004/poster-proceedings/paper-44,The OWL-S Java API,The OWL-S Java API,f409f300f763de096fea4a0fac8d1c1478cf5e83
2162,https://w3id.org/scholarlydata/inproceedings/iswc2004/poster-proceedings/paper-45,Pellet: An OWL DL Reasoner,Pellet: An OWL DL Reasoner,49ea217068781d3f3d07ef258b84a1fd4cae9528
2163,https://w3id.org/scholarlydata/inproceedings/iswc2004/poster-proceedings/paper-46,Hypermedia Inspired Ontology Engineering Environment: SWOOP,Hypermedia Inspired Ontology Engineering Environment: SWOOP,6cb1659036507c47841b8b1bbe3511029ad77570
2164,https://w3id.org/scholarlydata/inproceedings/iswc2004/poster-proceedings/paper-48,A Framework for Ontology-based Authoring Environments,A Framework for Ontology-based Authoring Environments,a533a34eb0e209e1f8d8f1faf9b36703dfe8c6f2
2165,https://w3id.org/scholarlydata/inproceedings/iswc2004/poster-proceedings/paper-02,Integrated Visualization for Semantic Web,Integrated Visualization for Semantic Web,9b76fa8d24f36531166fceac70b1069751812535
2166,https://w3id.org/scholarlydata/inproceedings/iswc2004/poster-proceedings/paper-04,Describing Data Sources Semantically for Facilitating Efficient Creation of OLAP Cubes,Describing Data Sources Semantically for Facilitating Efficient Creation of OLAP Cubes,d9cf29de21fe45a53f414d42aa959078bdc9f380
2167,https://w3id.org/scholarlydata/inproceedings/iswc2004/poster-proceedings/paper-05,Towards Semantic Web-Based Yellow Page Directory Services,Towards Semantic Web-Based Yellow Page Directory Services,2913e1fa18e5985147da9484e14b660b876a20f8
2168,https://w3id.org/scholarlydata/inproceedings/iswc2004/poster-proceedings/paper-06,Building an Ontology for NEWS Applications,Building an Ontology for NEWS � Applications,b142fb6c2b3840eaad013246dad895cf4d786608
2169,https://w3id.org/scholarlydata/inproceedings/iswc2004/demo-proceedings/paper-25,ASSAM : A Tool for Semi-Automatically Annotating Semantic Web Services,ASSAM: A Tool for Semi-automatically Annotating Semantic Web Services,449030fac9f669e668bbed43376e7cb642fc3634
2170,https://w3id.org/scholarlydata/inproceedings/iswc2004/demo-proceedings/paper-26,Artificial Memory Prototype for Personal Semantic Subdocument Knowledge Management (PS-KM),Artificial Memory Prototype for Personal Semantic Subdocument Knowledge Management (PS-KM),38b327de9aa20b7e7be99424eb0b82e7f8391f81
2171,https://w3id.org/scholarlydata/inproceedings/iswc2004/demo-proceedings/paper-22,MiXA: A Musical Annotation System,MiXA : A Musical Annotation System,b4a1cb2cf22392443787e426f51e5b53109e91e3
2172,https://w3id.org/scholarlydata/inproceedings/iswc2004/demo-proceedings/paper-23,iVAS: Web-based Video Annotation System and its Applications,iVAS : Web-based Video Annotation System and its Applications,c794b80710470bc5c07fae70e4c4b36091c717ee
2173,https://w3id.org/scholarlydata/inproceedings/iswc2004/demo-proceedings/paper-21,DR-DEVICE: A Defeasible Logic RDF Rule Language,DR-DEVICE: a Defeasible Logic RDF Rule Language,a6c5a4e1d6c7b840d86ec1154d8848e4dcb28804
