,uri,tituloOriginal,tituloExtraido,codigo
707,https://w3id.org/scholarlydata/inproceedings/lrec2008/papers/652,"CallSurf: Automatic Transcription, Indexing and Structuration of Call Center Conversational Speech for Knowledge Extraction and Query by Content","CallSurf: Automatic Transcription, Indexing and Structuration of Call Center Conversational Speech for Knowledge Extraction and Query by Content",7f1185a1248433e2871491752cd4a43b33a37f77
708,https://w3id.org/scholarlydata/inproceedings/lrec2008/papers/638,From Sentence to Discourse: Building an Annotation Scheme for Discourse Based on Prague Dependency Treebank,From Sentence to Discourse: Building an Annotation Scheme for Discourse Based on Prague Dependency Treebank,5fd8d13307240ebbef9d768fef6eede04323364c
709,https://w3id.org/scholarlydata/inproceedings/lrec2008/papers/819,Information Extraction Tools and Methods for Understanding Dialogue in a Companion,Information Extraction Tools and Methods for Understanding Dialogue in a Companion,5c5da0ba200d47385f9cf2291849b9307ae934ab
710,https://w3id.org/scholarlydata/inproceedings/lrec2008/papers/173,Automatic Translation of Biomedical Terms by Supervised Machine Learning,Automatic Translation of Biomedical Terms by Supervised Machine Learning,e5b70c66e997b74847ac544af88a2e6d9879fc14
711,https://w3id.org/scholarlydata/inproceedings/lrec2008/papers/892,Using the Complexity of the Distribution of Lexical Elements as a Feature in Authorship Attribution,Using the Complexity of the Distribution of Lexical Elements as a Feature in Authorship Attribution,f2b717cea07cb4e5d3b3e0fc955a15d9873208e8
712,https://w3id.org/scholarlydata/inproceedings/lrec2008/papers/303,Is this NE tagger getting old?,Is this NE tagger getting old?,72a8d5ea1c6571e15d241b404071077226929ad0
713,https://w3id.org/scholarlydata/inproceedings/lrec2008/papers/823,Using Similarity Measures to Extend the LinGO Lexicon,Using Similarity Measures to Extend the LinGO Lexicon,dcd82249e6410673227c5a7b05cf902820330037
714,https://w3id.org/scholarlydata/inproceedings/lrec2008/papers/822,Translation-oriented Word Sense Induction Based on Parallel Corpora,Translation-oriented Word Sense Induction Based on Parallel Corpora,ecb2eb90e8d4a42c55e055fd9dee11dc8a0a0fa8
715,https://w3id.org/scholarlydata/inproceedings/lrec2008/papers/279,Evaluating Dialogue Act Tagging with Naive and Expert Annotators,Evaluating Dialogue Act Tagging with Naive and Expert Annotators,9201380a3688024e4b8f3ab665bf86bf563f2831
716,https://w3id.org/scholarlydata/inproceedings/lrec2008/papers/152,"A Trainable Tokenizer, solution for multilingual texts and compound expression tokenization","A Trainable Tokenizer, solution for multilingual texts and compound expression tokenization",2a3a63b3028de8e1f10b4edf83f4e2ce8a813079
717,https://w3id.org/scholarlydata/inproceedings/lrec2008/papers/460,Learning the Species of Biomedical Named Entities from Annotated Corpora,Learning the Species of Biomedical Named Entities from Annotated Corpora,20e13ea67daa2a83727aedea3bf3f2fe9b75eac0
718,https://w3id.org/scholarlydata/inproceedings/lrec2008/papers/169,Automatic Acquisition of Usage Information for Language Resources,Automatic Acquisition of Usage Information for Language Resources,a4f82b27109a13a75ceb76b7d3be6b136cfdd1c2
719,https://w3id.org/scholarlydata/inproceedings/lrec2008/papers/428,Construction of a Metadata Database for Efficient Development and Use of Language Resources,Construction of a Metadata Database for Efficient Development and Use of Language Resources,413af27cd55947f249ac378e390b7f1c50d3d9b5
720,https://w3id.org/scholarlydata/inproceedings/lrec2008/papers/814,Answering List Questions using Co-occurrence and Clustering,Answering List Questions using Co-occurrence and Clustering,5d4a07c77ab4e4fae90e7b0dbd18b82227bf818d
721,https://w3id.org/scholarlydata/inproceedings/lrec2008/papers/769,Navigating through Dense Annotation Spaces,Navigating through Dense Annotation Spaces,a28c6d792e7b97eb74e8f5fa146343bfa7e46fc8
722,https://w3id.org/scholarlydata/inproceedings/lrec2008/papers/813,Annotating Topics of Opinions,Annotating Topics of Opinions,5cf2d0f72c2c910457cbd35164dfc581dbaba658
723,https://w3id.org/scholarlydata/inproceedings/lrec2008/papers/68,Borrowing Language Resources for Development of Automatic Speech Recognition for Low- and Middle-Density Languages,Borrowing Language Resources for Development of Automatic Speech Recognition for Low- and Middle-Density Languages,9b47fdf7b748cc208ecd9f8bfff921d9b7deecd2
724,https://w3id.org/scholarlydata/inproceedings/lrec2008/papers/817,GMT to +2 or how can TimeML be used in Romanian,GMT to +2 or how can TimeML be used in Romanian,db81890e1ffc565e2bd67c5fc0ae41823324545a
725,https://w3id.org/scholarlydata/inproceedings/lrec2008/papers/334,Automatic Acquisition for low frequency lexical items,Automatic Acquisition for low frequency lexical items,71ac53a59360a1a6e9570a0e03457e51cf121b05
726,https://w3id.org/scholarlydata/inproceedings/lrec2008/papers/914,Statistical Evaluation of Information Distillation Systems,Statistical Evaluation of Information Distillation Systems,f1672bf1c20b21d0ce420544eb5732f7d50b3768
727,https://w3id.org/scholarlydata/inproceedings/lrec2008/papers/191,New Functions of FrameSQL for Multilingual FrameNets,New Functions of FrameSQL for Multilingual FrameNets,1851aff35ca2997159353712edd8615dd3c75ad9
728,https://w3id.org/scholarlydata/inproceedings/lrec2008/papers/881,Spock - a Spoken Corpus Client,Spock - a Spoken Corpus Client,e79f448e19170814bb2c4e49910ad5d84b368044
729,https://w3id.org/scholarlydata/inproceedings/lrec2008/papers/550,"Dialogue, Speech and Images: the Companions Project Data Set","Dialogue, Speech and Images: the Companions Project Data Set",52ab471ec274aae51a6b9c048f353af3063c1862
730,https://w3id.org/scholarlydata/inproceedings/lrec2008/papers/523,Extraction and Evaluation of Keywords from Learning Objects: a Multilingual Approach,Extraction and Evaluation of Keywords from Learning Objects: a Multilingual Approach,c789609c897eed8042a439f7846e163dd40d70c6
731,https://w3id.org/scholarlydata/inproceedings/lrec2008/papers/290,Validating the Quality of Full Morphological Annotation,Validating the Quality of Full Morphological Annotation,205803714a2d8d170bc0b3135bed15b67c624413
732,https://w3id.org/scholarlydata/inproceedings/lrec2008/papers/544,Acquiring a Taxonomy from the German Wikipedia,Acquiring a Taxonomy from the German Wikipedia,40593009576c8a68bb539a088f00a53ffec78569
733,https://w3id.org/scholarlydata/inproceedings/lrec2008/papers/676,Centering Theory for Evaluation of Coherence in Computer-Aided Summaries,Centering Theory for Evaluation of Coherence in Computer-Aided Summaries,d506bed15972c5cc13bf134d919477f4539e0866
734,https://w3id.org/scholarlydata/inproceedings/lrec2008/papers/558,Relationships between Nursing Converstaions and Activities,Relationships between Nursing Converstaions and Activities,0b493ef03d343c329d3a617d9937b839929457af
735,https://w3id.org/scholarlydata/inproceedings/lrec2008/papers/402,"Keywords, k-NN and Neural Networks: a Support for Hierarchical Categorization of Texts in Brazilian Portuguese","Keywords, k-NN and Neural Networks: a Support for Hierarchical Categorization of Texts in Brazilian Portuguese",7368d18cbe09c8f2914e74224f7c8a2c1688f9c2
736,https://w3id.org/scholarlydata/inproceedings/lrec2008/papers/155,On the Use of Web Resources and Natural Language Processing Techniques to Improve Automatic Speech Recognition Systems,On the Use of Web Resources and Natural Language Processing Techniques to Improve Automatic Speech Recognition Systems,9cbc338d8d055d2eb10acc57ca0ed458a16c64ac
737,https://w3id.org/scholarlydata/inproceedings/lrec2008/papers/172,Automatic Rich Annotation of Large Corpus of Conversational transcribed speech: the Chunking Task of the EPAC Project,Automatic Rich Annotation of Large Corpus of Conversational transcribed speech: the Chunking Task of the EPAC Project,1f2c730655d4a4c4de1b8fce464b6165c0687fd6
738,https://w3id.org/scholarlydata/inproceedings/lrec2008/papers/93,Towards Formal Interpretation of Semantic Annotation,Towards Formal Interpretation of Semantic Annotation,c9be9685c6202341fe87620e376d36659a7d9d30
739,https://w3id.org/scholarlydata/inproceedings/lrec2008/papers/695,Inter-sentential Coreferences in Semantic Networks: An Evaluation of Manual Annotation,Inter-sentential Coreferences in Semantic Networks: An Evaluation of Manual Annotation,2887fa07f3d19f710a965986e3a421754401559c
740,https://w3id.org/scholarlydata/inproceedings/lrec2008/papers/185,Analysis and Performance of Morphological Query Expansion and Language-Filtering Words on Basque Web Searching,Analysis and Performance of Morphological Query Expansion and Language-Filtering Words on Basque Web Searching,d6d8aafbaf55fe5bb4b49a57ca6bc2c880664229
741,https://w3id.org/scholarlydata/inproceedings/lrec2008/papers/654,Towards Semi Automatic Construction of a Lexical Ontology for Persian,Towards Semi Automatic Construction of a Lexical Ontology for Persian,57d9e792392f4384a20f69f59a03c1418f7bed06
742,https://w3id.org/scholarlydata/inproceedings/lrec2008/papers/262,Ontology Search with the OntoSelect Ontology Library,Ontology Search with the OntoSelect Ontology Library,8816926e5543ba8623ef61c4e627c769087e4d1f
743,https://w3id.org/scholarlydata/inproceedings/lrec2008/papers/663,A Study of Parentheticals in Discourse Corpora - Implications for NLG Systems,A Study of Parentheticals in Discourse Corpora - Implications for NLG Systems,ad927bc294b87c8afc7cc3382fd417b26dd4deee
744,https://w3id.org/scholarlydata/inproceedings/lrec2008/papers/671,Semiotic-based Ontology Evaluation Tool (S-OntoEval),Semiotic-based Ontology Evaluation Tool (S-OntoEval),cef120b2d14747a345d9924d84ec60ea84859407
745,https://w3id.org/scholarlydata/inproceedings/lrec2008/papers/626,Building a Bilingual Representation of the Roget Thesaurus for French to English Machine Translation,Building a Bilingual Representation of the Roget Thesaurus for French to English Machine Translation,7ca8e98e9c52e7d26b4af0f9f9ec57794b76e17a
746,https://w3id.org/scholarlydata/inproceedings/lrec2008/papers/521,Spatiotemporal Coding in ANVIL,Spatiotemporal Coding in ANVIL,7320121144147fc861a378f861a2e707beee3142
747,https://w3id.org/scholarlydata/inproceedings/lrec2008/papers/146,Unsupervised Resource Creation for Textual Inference Applications,Unsupervised Resource Creation for Textual Inference Applications,3ca03ef57cb9a0e7f242f0690307dafde0c8677c
748,https://w3id.org/scholarlydata/inproceedings/lrec2008/papers/403,Post-MT Term Swapper: Supplementing a Statistical Machine Translation System with a User Dictionary,Post-MT Term Swapper: Supplementing a Statistical Machine Translation System with a User Dictionary,35779b52e6936ef84274e76c02375646588af74b
749,https://w3id.org/scholarlydata/inproceedings/lrec2008/papers/429,The Extended Architecture of Hantology for Japan Kanji,The Extended Architecture of Hantology for Japan Kanji,3cb825672b893790dcb52dcb61824e43926cc2d0
750,https://w3id.org/scholarlydata/inproceedings/lrec2008/papers/519,Producing an Encyclopedic Dictionary using Patent Documents,Producing an Encyclopedic Dictionary using Patent Documents,cc66a0af1d1b08bf1044f906f1f6dbfc901adf18
751,https://w3id.org/scholarlydata/inproceedings/lrec2008/papers/765,Knowledge-based Coreference Resolution for Hungarian,Knowledge-based Coreference Resolution for Hungarian,00f5ea46651c44a98e8c18d75e6ceaddbcb2fd55
752,https://w3id.org/scholarlydata/inproceedings/lrec2008/papers/176,The Kalshnikov 691 Dependency Bank,The Kalshnikov 691 Dependency Bank,957056353e3b7d7200c6e84db67c5c6415aa410d
753,https://w3id.org/scholarlydata/inproceedings/lrec2008/papers/790,Word-level Dependency-structure Annotation to Corpus of Spontaneous Japanese and its Application,Word-level Dependency-structure Annotation to Corpus of Spontaneous Japanese and its Application,df9b1eba54fb9a0f63ff5f354f3feaa29c0632b2
754,https://w3id.org/scholarlydata/inproceedings/lrec2008/papers/91,Prolexbase: a Multilingual Relational Lexical Database of Proper Names,Prolexbase: a Multilingual Relational Lexical Database of Proper Names,66be9b43b244f3ba60433fb887e8a0e23c736152
755,https://w3id.org/scholarlydata/inproceedings/lrec2008/papers/567,Frame Information Transfer from English to Italian,Frame Information Transfer from English to Italian,43057e6e23c59e77a214c7962ac8203c97355b1d
756,https://w3id.org/scholarlydata/inproceedings/lrec2008/papers/562,A Web Browser Extension for Growing-up Ontological Knowledge from Traditional Web Content,A Web Browser Extension for Growing-up Ontological Knowledge from Traditional Web Content,b5d822f74cfc7c8dfbccbc8694d08d72ead5561c
757,https://w3id.org/scholarlydata/inproceedings/lrec2008/papers/143,FATE: a FrameNet-Annotated Corpus for Textual Entailment,FATE: a FrameNet-Annotated Corpus for Textual Entailment,95381aabca2bccf6851c48ce55566ad49c869955
758,https://w3id.org/scholarlydata/inproceedings/lrec2008/papers/308,Toward Active Learning in Data Selection: Automatic Discovery of Language Features During Elicitation,Toward Active Learning in Data Selection: Automatic Discovery of Language Features During Elicitation,fc8a2c424087fa0826f01babe36041d41c095d6b
759,https://w3id.org/scholarlydata/inproceedings/lrec2008/papers/631,Rule-Based Chunker for Croatian,Rule-Based Chunker for Croatian,5c4aec6952bb815759080d0a386ad33c183e74f9
760,https://w3id.org/scholarlydata/inproceedings/lrec2008/papers/280,Certification and Cleaning up of a Text Corpus: Towards an Evaluation of the  Grammatical  Quality of a Corpus,"Certification and Cleaning up of a Text Corpus: Towards an Evaluation of the ""Grammatical"" Quality of a Corpus",f70f2b6296b6503dc9d3460abf980b41c4b2c1d7
761,https://w3id.org/scholarlydata/inproceedings/lrec2008/papers/275,Lexical Substitution as a Framework for Multiword Evaluation,Lexical Substitution as a Framework for Multiword Evaluation,ffa885c6156fba8385c3a299cbef513e2a1d55f2
762,https://w3id.org/scholarlydata/inproceedings/lrec2008/papers/904,KnoFusius: a New Knowledge Fusion System for Interpretation of Gene Expression Data,KnoFusius: a New Knowledge Fusion System for Interpretation of Gene Expression Data,b28b3b78b33ed77af86c0b43dc9efb928419ed53
763,https://w3id.org/scholarlydata/inproceedings/lrec2008/papers/789,Projecting Propbank Roles onto the CCGbank,Projecting Propbank Roles onto the CCGbank,337f66fe023d225bbec7b8407fad128109a51213
764,https://w3id.org/scholarlydata/inproceedings/lrec2008/papers/288,Acquiring Naturalistic Concept Descriptions from the Web,Acquiring Naturalistic Concept Descriptions from the Web,cefd62f862ddd5d44687c97ccc093cf1a5377885
765,https://w3id.org/scholarlydata/inproceedings/lrec2008/papers/909,Annotation of Nuggets and Relevance in GALE Distillation Evaluation,Annotation of Nuggets and Relevance in GALE Distillation Evaluation,823e95cba06102025c9658b08b7a25dc3f039fd4
766,https://w3id.org/scholarlydata/inproceedings/lrec2008/papers/96,A Research on Automatic Chinese Catchword Extraction,A Research on Automatic Chinese Catchword Extraction,b3d36c64338382ecf18208e22404e36708e5935c
767,https://w3id.org/scholarlydata/inproceedings/lrec2008/papers/64,A Text-based Query Interface to OWL Ontologies,A Text-based Query Interface to OWL Ontologies,5c391e4c8f9c5b0c1b052adadb53cab5d02ab5c3
768,https://w3id.org/scholarlydata/inproceedings/lrec2008/papers/66,Reusable Tagset Conversion Using Tagset Drivers,Reusable Tagset Conversion Using Tagset Drivers,a43f0fd5fec3df14c395cec3abb331efe116c57f
769,https://w3id.org/scholarlydata/inproceedings/lrec2008/papers/89,The JOS Morphosyntactically Tagged Corpus of Slovene,The JOS Morphosyntactically Tagged Corpus of Slovene,5a948f7c173201ab264acf7b956c4994d44e059b
770,https://w3id.org/scholarlydata/inproceedings/lrec2008/papers/130,Building Affective Lexicons from Specific Corpora for Automatic Sentiment Analysis,Building Affective Lexicons from Specific Corpora for Automatic Sentiment Analysis,47d04b0a9e63567e351098507f40107295fdbba7
771,https://w3id.org/scholarlydata/inproceedings/lrec2008/papers/629,Clustering of Terms from Translation Dictionaries and Synonyms Lists to Automatically Build more Structured Linguistic Resources,Clustering of Terms from Translation Dictionaries and Synonyms Lists to Automatically Build more Structured Linguistic Resources,1f4f0ef72efe678daacdbf5efc6e32d31172cec0
772,https://w3id.org/scholarlydata/inproceedings/lrec2008/papers/284,Yet another Platform for Extracting Knowledge from Corpora,Yet another Platform for Extracting Knowledge from Corpora,e35c8b4090bf5573359f15b6a5576b6908602e09
773,https://w3id.org/scholarlydata/inproceedings/lrec2008/papers/770,A Framework for Standardized Syntactic Annotation,A Framework for Standardized Syntactic Annotation,4f96959336576f4fb50fa0821ee3eb72aa0a4e6d
774,https://w3id.org/scholarlydata/inproceedings/lrec2008/papers/292,Using Log-linear Models for Tuning Machine Translation Output,Using Log-linear Models for Tuning Machine Translation Output,94b7c36a110abc3a6c5264dd8aa8954f7a4089c9
775,https://w3id.org/scholarlydata/inproceedings/www2011/paper/estimating-sizes-of-social-networks-via-biased-sam,Estimating Sizes of Social Networks via Biased Sampling,Estimating Sizes of Social Networks via Biased Sampling,a7a98f475968e33b7b2ae224d97a4a9bf0c61c7f
776,https://w3id.org/scholarlydata/inproceedings/www2011/phd/addressing-the-rdfa-publishing-bottleneck,Addressing the RDFa Publishing Bottleneck,Addressing the RDFa publishing bottleneck,bd0ae57848bb9e7ae9b3932ca37334b077eccad4
777,https://w3id.org/scholarlydata/inproceedings/www2011/poster/ontowiki-mobile-knowledge-management-in-your-pocke,OntoWiki Mobile - Knowledge Management in Your Pocket,OntoWiki Mobile - Knowledge Management in Your Pocket,316f31479a5a6fcf84818e03152fff8f23e3746a
778,https://w3id.org/scholarlydata/inproceedings/www2011/poster/a-classification-based-framework-for-concept-summa,A Classification Based Framework for Concept Summarization,A Classification Based Framework for Concept Summarization,783df3a1a994546e2b814ce68895f667230b27a3
779,https://w3id.org/scholarlydata/inproceedings/www2011/poster/a-classification-based-framework-for-concept-summa,A Classification Based Framework for Concept Summarization,A Classification Based Framework for Concept Summarization,66ce49adfc49a0915a03f1b6d1310b89aabaa130
780,https://w3id.org/scholarlydata/inproceedings/www2011/paper/arrow-generating-signatures-to-detect-drive-by-dow,ARROW: GenerAting SignatuRes to Detect DRive-By DOWnloads,ARROW: GenerAting SignatuRes to Detect DRive-By DOWnloads,556a1aefa5122461e97141a49963e76fe15c25bd
781,https://w3id.org/scholarlydata/inproceedings/www2011/poster/influence-and-passivity-in-social-media,Influence and Passivity in Social Media,Influence and Passivity in Social Media,54fced7107b4f7ff99836d080b2e5a4092e71950
782,https://w3id.org/scholarlydata/inproceedings/www2011/poster/influence-and-passivity-in-social-media,Influence and Passivity in Social Media,Influence and Passivity in Social Media,05e6ec3d6fbb636adf60ac59cd33015d1243891b
783,https://w3id.org/scholarlydata/inproceedings/www2011/paper/an-expressive-mechanism-for-auctions-on-the-web,An Expressive Mechanism for Auctions on the Web,An Expressive Mechanism for Auctions on the Web,7f61d0bec9941c48419bed09b9f29bca1e76dd58
784,https://w3id.org/scholarlydata/inproceedings/www2011/paper/an-expressive-mechanism-for-auctions-on-the-web,An Expressive Mechanism for Auctions on the Web,An Expressive Mechanism for Auctions on the Web,65a82f230ad0e89b97a93b0dd7b843aec19eaba9
785,https://w3id.org/scholarlydata/inproceedings/www2011/paper/choreography-conformance-via-synchronizability,Choreography Conformance via Synchronizability,Choreography conformance via synchronizability,6b146791992a34c471aa45a55e4d2b2fdddff6f4
786,https://w3id.org/scholarlydata/inproceedings/www2011/paper/modeling-the-temporal-dynamics-of-social-rating-ne,Modeling the Temporal Dynamics of Social Rating Networks Using Bidirectional Effects of Social Relations and Rating Patterns,Modeling the Temporal Dynamics of Social Rating Networks Using Bidirectional Effects of Social Relations and Rating Patterns,b5ce6a0f6ca95144882c640c4f2fc9feb8eb0c79
787,https://w3id.org/scholarlydata/inproceedings/www2011/paper/modeling-the-temporal-dynamics-of-social-rating-ne,Modeling the Temporal Dynamics of Social Rating Networks Using Bidirectional Effects of Social Relations and Rating Patterns,Modeling the Temporal Dynamics of Social Rating Networks Using Bidirectional Effects of Social Relations and Rating Patterns,79e8b76d4d1e456399d392ac02a63945100bab92
788,https://w3id.org/scholarlydata/inproceedings/www2012/dev/11,"WikiNext, a JavaScript Semantic Wiki","WikiNext, a JavaScript Semantic Wiki",1a27c16100134a269a6b1f541588a85ab5087225
789,https://w3id.org/scholarlydata/inproceedings/www2012/dev/17,LDIF - A Framework for Large-Scale Linked Data Integration,LDIF - A Framework for Large-Scale Linked Data Integration,919951283a3d465605d9ca14b8bcff7675045ef6
790,https://w3id.org/scholarlydata/inproceedings/www2012/paper/944,Online Modeling of Proactive Moderation System for Auction Fraud Detection,Online Modeling of Proactive Moderation System for Auction Fraud Detection,6138756e51479a499ebfc17c8e9d0569b93dc1b9
791,https://w3id.org/scholarlydata/inproceedings/www2012/paper/944,Online Modeling of Proactive Moderation System for Auction Fraud Detection,Online Modeling of Proactive Moderation System for Auction Fraud Detection,29b0b617c32c60bcaa2f732f4e570751b01b6b41
792,https://w3id.org/scholarlydata/inproceedings/www2012/poster/167,Multiple spreaders affect the indirect influence on Twitter,Multiple spreaders affect the indirect influence on twitter,1824b3a62d364d3dfc387b9f5f52691b93ba5889
793,https://w3id.org/scholarlydata/inproceedings/www2012/dev/16,The Information Workbench as a Self-Service Platform for Developing Linked Data Applications,The Information Workbench as a Self-Service Platform for Developing Linked Data Applications,d64a2c96c1106bcb43bf8999339ec5f2bd450b2c
794,https://w3id.org/scholarlydata/inproceedings/www2012/paper/921,TailGate: Handling long-tail content with a little help from friends,TailGate: handling long-tail content with a little help from friends,3e63cefd9e0b67e4273b2ee8084b89bf5de353c3
795,https://w3id.org/scholarlydata/inproceedings/www2012/paper/645,Towards Network-aware Service Composition in the Cloud,Towards Network-Aware Service Composition in the Cloud,5454a9a69410eec4d39c0fd05774c82445a04900
796,https://w3id.org/scholarlydata/inproceedings/www2012/paper/545,Answering Search Queries with CrowdSearcher,Answering search queries with CrowdSearcher,603a8f2198b531f2edf0750095f5239da4b1b576
797,https://w3id.org/scholarlydata/inproceedings/www2012/demo/61,"Turning a Web 2.0 Social Network into a Web 3.0, distributed, and secured Social Web application","Turning a Web 2.0 social network into a Web 3.0, distributed, and secured social web application",dce5efb37bb8433a35436be5d4b518cbb8d7ad09
798,https://w3id.org/scholarlydata/inproceedings/www2012/paper/272,Economics of BitTorrent Communities,Economics of BitTorrent communities,192f06c9151d57d794373f293a42326e7613161d
799,https://w3id.org/scholarlydata/inproceedings/www2012/eu/25,Social media meta-API: Leveraging the content of Social Networks,Social media meta-API: leveraging the content of social networks,2ee4dfe61dedc54600c3bf0be5fd57da28c0ac48
800,https://w3id.org/scholarlydata/inproceedings/www2012/paper/860,Combining Flat and Structured Approaches for Temporal Slot Filling or: How Much to Compress?,Combining Flat and Structured Approaches for Temporal Slot Filling or: How Much to Compress?,f82e071770b83259ad786998163418d172a8bd5d
801,https://w3id.org/scholarlydata/inproceedings/www2012/poster/182,Privacy Management for Online Social Networks,Privacy Management for Online Social Networks,46cef6fde1e629d6b7aab88cbf9a91711e713780
802,https://w3id.org/scholarlydata/inproceedings/www2012/poster/190,Unified Classification Model For Geotagging Websites,Unified Classification Model for Geotagging Websites,08a5b18241efa1993266d7e302df50f959b01414
803,https://w3id.org/scholarlydata/inproceedings/www2012/poster/268,Identifying Sentiments over N-gram,Identifying sentiments over N-gram,d32bcfcbda913facb52c919f95e504f41f089526
804,https://w3id.org/scholarlydata/inproceedings/www2012/paper/453,Using Variational Inference and MapReduce to Scale Topic Modeling,Using Variational Inference and MapReduce to Scale Topic Modeling,0352fa2cec796f5417a7a9b3dc7a6ce4bae7f4bf
805,https://w3id.org/scholarlydata/inproceedings/www2012/paper/1272,How Effective is Targeted Advertising?,How Effective is Targeted Advertising?,d82be5a6520fff0ff05bb395ef5b444df660c311
806,https://w3id.org/scholarlydata/inproceedings/www2012/paper/1064,Are Web users really Markovian?,Are web users really Markovian?,228b3e64d66e8f00d03bf1edecb07b27c0c0b953
807,https://w3id.org/scholarlydata/inproceedings/www2012/paper/809,"Counting beyond a Yottabyte, or how SPARQL 1.1 Property Paths will prevent adoption of the standard","Counting beyond a Yottabyte, or how SPARQL 1.1 property paths will prevent adoption of the standard",293700d335c1a842d29ecf1248dba0ea1569fcdd
808,https://w3id.org/scholarlydata/inproceedings/www2012/paper/1247,Strategic Formation of Credit Networks,Strategic Formation of Credit Networks,b0e0368f2f7afc26133514b3e4beb0d834523f95
809,https://w3id.org/scholarlydata/inproceedings/www2012/poster/156,Photo-TaPE: User privacy preferences in photo tagging,Photo-TaPE: user privacy preferences in photo tagging,919ddf61520d7e1263c90deba19348f5313db248
810,https://w3id.org/scholarlydata/inproceedings/www2012/poster/120,Actualization of query suggestions using query logs,Actualization of query suggestions using query logs,3435fe8c5998315cdf1be8d672857835d5412428
